{
  "$schema": "https://json-schema.org/draft/2020-12/schema",
  "$id": "urn:towr:magic-simulation:result:1",
  "$comment": "Structural contract. Strict token spelling and semantic admission are adapter responsibilities.",
  "type": "object",
  "properties": {
    "schema_version": {
      "type": "string",
      "const": "1"
    },
    "kind": {
      "type": "string",
      "const": "npc_magic_simulation_result"
    },
    "request": {
      "$ref": "urn:towr:magic-simulation:request:1"
    },
    "seed_scheme": {
      "type": "string",
      "const": "towr:npc-magic-trial:v1"
    },
    "runtime": {
      "type": "object",
      "properties": {
        "package_version": {
          "type": "string",
          "minLength": 1,
          "pattern": "\\S"
        },
        "python_implementation": {
          "type": "string",
          "minLength": 1,
          "pattern": "\\S"
        },
        "python_version": {
          "type": "string",
          "minLength": 1,
          "pattern": "\\S"
        },
        "rng": {
          "type": "string",
          "const": "random.Random"
        }
      },
      "required": [
        "package_version",
        "python_implementation",
        "python_version",
        "rng"
      ],
      "additionalProperties": false
    },
    "summary": {
      "type": "object",
      "properties": {
        "trials": {
          "type": "integer",
          "minimum": 1,
          "maximum": 18446744073709551615
        },
        "outcome_counts": {
          "type": "object",
          "properties": {
            "objective_achieved": {
              "type": "integer",
              "minimum": 0
            },
            "perspective_defeated": {
              "type": "integer",
              "minimum": 0
            },
            "round_limit_reached": {
              "type": "integer",
              "minimum": 0
            },
            "unsupported_path": {
              "type": "integer",
              "minimum": 0
            }
          },
          "required": [
            "objective_achieved",
            "perspective_defeated",
            "round_limit_reached",
            "unsupported_path"
          ],
          "additionalProperties": false
        },
        "total_action_count": {
          "type": "integer",
          "minimum": 0
        },
        "total_started_round_count": {
          "type": "integer",
          "minimum": 1
        },
        "total_completed_round_count": {
          "type": "integer",
          "minimum": 0
        }
      },
      "required": [
        "trials",
        "outcome_counts",
        "total_action_count",
        "total_started_round_count",
        "total_completed_round_count"
      ],
      "additionalProperties": false
    }
  },
  "required": [
    "schema_version",
    "kind",
    "request",
    "seed_scheme",
    "runtime",
    "summary"
  ],
  "additionalProperties": false
}
